{
  "$schema": "https://json-schema.org/draft/2020-12/schema",
  "$id": "urn:lantern:schema:vocabulary-type:1",
  "title": "Vocabulary type",
  "description": "An entity, relationship or attribute type in the vocabulary registry. See docs/design.md, Knowledge model and schema evolution, and docs/adr/0002-vocabulary-registry.md.",
  "type": "object",
  "additionalProperties": false,
  "required": ["name", "kind", "attributeSchema"],
  "properties": {
    "name": {
      "description": "Entity types use the type form of an entity ID; relationship and attribute types use the predicate form. One namespace for all kinds.",
      "type": "string"
    },
    "kind": { "enum": ["entity", "relationship", "attribute"] },
    "parent": {
      "description": "Name of the parent type, of the same kind. Absent for a root type.",
      "type": "string"
    },
    "c4Level": {
      "description": "C4 level; inherited from the parent type when absent.",
      "enum": ["context", "container", "component", "code"]
    },
    "shape": {
      "description": "Default shape; inherited from the parent type when absent.",
      "$ref": "#/$defs/token"
    },
    "icon": {
      "description": "Default icon; inherited from the parent type when absent.",
      "$ref": "#/$defs/token"
    },
    "description": { "type": "string", "pattern": "\\S" },
    "attributeSchema": { "$ref": "#/$defs/attributeSchema" }
  },
  "allOf": [
    {
      "if": { "properties": { "kind": { "const": "entity" } } },
      "then": {
        "properties": {
          "name": { "$ref": "#/$defs/entityTypeName" },
          "parent": { "$ref": "#/$defs/entityTypeName" }
        }
      },
      "else": {
        "properties": {
          "name": { "$ref": "#/$defs/predicateName" },
          "parent": { "$ref": "#/$defs/predicateName" }
        }
      }
    }
  ],
  "$defs": {
    "entityTypeName": { "type": "string", "pattern": "^[a-z][a-z0-9-]*$" },
    "predicateName": { "type": "string", "pattern": "^[A-Za-z][A-Za-z0-9_.-]*$" },
    "attributeName": { "type": "string", "pattern": "^[A-Za-z][A-Za-z0-9_.-]*$" },
    "token": { "type": "string", "pattern": "^[a-z][a-z0-9-]*$" },
    "attributeSchema": {
      "description": "A subset of JSON Schema for the fact's attributes, on top of the parent type's. additionalProperties defaults to true, as in JSON Schema.",
      "type": "object",
      "additionalProperties": false,
      "properties": {
        "type": { "const": "object" },
        "properties": {
          "type": "object",
          "propertyNames": { "$ref": "#/$defs/attributeName" },
          "additionalProperties": { "$ref": "#/$defs/property" }
        },
        "required": {
          "type": "array",
          "uniqueItems": true,
          "items": { "$ref": "#/$defs/attributeName" }
        },
        "additionalProperties": { "type": "boolean" }
      }
    },
    "property": {
      "type": "object",
      "additionalProperties": false,
      "required": ["type"],
      "properties": {
        "type": { "enum": ["string", "integer", "number", "boolean", "array", "object"] },
        "description": { "type": "string", "pattern": "\\S" },
        "enum": {
          "description": "Allowed values; string attributes only.",
          "type": "array",
          "minItems": 1,
          "uniqueItems": true,
          "items": { "type": "string" }
        },
        "items": {
          "description": "Schema for every element; array attributes only.",
          "$ref": "#/$defs/property"
        }
      },
      "dependentSchemas": {
        "enum": { "properties": { "type": { "const": "string" } } },
        "items": { "properties": { "type": { "const": "array" } } }
      }
    }
  }
}
