[
  {
    "name": "system",
    "kind": "entity",
    "c4Level": "context",
    "shape": "box",
    "description": "A software system, as shown on a C4 system context diagram.",
    "attributeSchema": { "additionalProperties": false }
  },
  {
    "name": "actor",
    "kind": "entity",
    "c4Level": "context",
    "shape": "person",
    "description": "Someone or something outside the system that uses it, such as a kind of person, as shown on a C4 system context diagram. Not a software system.",
    "attributeSchema": { "additionalProperties": false }
  },
  {
    "name": "container",
    "kind": "entity",
    "c4Level": "container",
    "shape": "box",
    "description": "A separately runnable or deployable unit, or a data store, within a system.",
    "attributeSchema": { "additionalProperties": false }
  },
  {
    "name": "component",
    "kind": "entity",
    "c4Level": "component",
    "shape": "box",
    "description": "A grouping of related code within a container.",
    "attributeSchema": { "additionalProperties": false }
  },
  {
    "name": "service",
    "kind": "entity",
    "parent": "container",
    "description": "A deployable service.",
    "attributeSchema": { "additionalProperties": false }
  },
  {
    "name": "library",
    "kind": "entity",
    "shape": "box",
    "description": "A library artifact that other code depends on but that is not deployed on its own. It has no C4 level: a library is not a container, and a thin service and its library are drawn as one container.",
    "attributeSchema": { "additionalProperties": false }
  },
  {
    "name": "module",
    "kind": "entity",
    "shape": "box",
    "description": "A build module, such as a Maven module. It has no C4 level: a module is a unit of the build, not a container or component.",
    "attributeSchema": { "additionalProperties": false }
  },
  {
    "name": "package",
    "kind": "entity",
    "shape": "folder",
    "description": "A Java package. It has no C4 level: a package is a way to group code, not a component.",
    "attributeSchema": { "additionalProperties": false }
  },
  {
    "name": "type",
    "kind": "entity",
    "c4Level": "code",
    "shape": "class",
    "description": "A Java class, interface, enum, record or annotation.",
    "attributeSchema": { "additionalProperties": false }
  },
  {
    "name": "repo",
    "kind": "entity",
    "description": "A repository of the snapshot, the subject of facts about files that belong to no module, such as a compose file in a deployment repository. Its key is the repository's name, as in the summaries. It has no C4 level.",
    "attributeSchema": { "additionalProperties": false }
  },
  {
    "name": "CONTAINS",
    "kind": "relationship",
    "shape": "nested",
    "description": "The subject contains the object, for example a module contains a package.",
    "attributeSchema": { "additionalProperties": false }
  },
  {
    "name": "DEPENDS_ON",
    "kind": "relationship",
    "shape": "dashed-arrow",
    "description": "The subject needs the object to build: a build dependency or what it packages. Runtime relationships are under INTERACTS_WITH instead.",
    "attributeSchema": { "additionalProperties": false }
  },
  {
    "name": "INTERACTS_WITH",
    "kind": "relationship",
    "shape": "arrow",
    "description": "The subject interacts with the object at runtime: it calls it, sends it messages, reads or writes its data, or connects to it. The root of every runtime relationship, kept apart from DEPENDS_ON, which is what the build needs, so a renderer falling back to a parent never draws a build edge as a runtime line.",
    "attributeSchema": { "additionalProperties": false }
  },
  {
    "name": "CALLS",
    "kind": "relationship",
    "parent": "INTERACTS_WITH",
    "shape": "arrow",
    "description": "The subject invokes the object at runtime.",
    "attributeSchema": { "additionalProperties": false }
  },
  {
    "name": "EXTENDS",
    "kind": "relationship",
    "shape": "hollow-arrow",
    "description": "The subject type extends the object type.",
    "attributeSchema": { "additionalProperties": false }
  },
  {
    "name": "IMPLEMENTS",
    "kind": "relationship",
    "shape": "dashed-hollow-arrow",
    "description": "The subject type implements the object interface.",
    "attributeSchema": { "additionalProperties": false }
  }
]
